{
  "$schema": "https://json-schema.org/draft/2020-12/schema",
  "$id": "https://pockethive.local/schemas/completed-work-producer-registry-v1.schema.json",
  "title": "PocketHive completed-work producer registry v1",
  "type": "object",
  "additionalProperties": false,
  "required": [
    "schemaVersion",
    "authority",
    "profileId",
    "profileDigest",
    "toolSourceDigest",
    "producers",
    "receiptAuthorizations",
    "generatedAt",
    "statement"
  ],
  "properties": {
    "schemaVersion": { "const": 1 },
    "authority": {
      "enum": ["CANDIDATE_UNVERIFIED", "OPERATOR_SUPPLIED"]
    },
    "profileId": {
      "enum": ["POCKETHIVE_DOCUMENTATION_V1", "POCKETHIVE_DOCS_AUTOMATION_V1"]
    },
    "profileDigest": { "$ref": "#/$defs/sha256" },
    "toolSourceDigest": { "$ref": "#/$defs/sha256" },
    "producers": {
      "type": "array",
      "maxItems": 128,
      "items": {
        "type": "object",
        "additionalProperties": false,
        "required": [
          "id",
          "digest",
          "adapters",
          "executionKinds",
          "evidenceKinds",
          "gateChecks",
          "reviewerIds"
        ],
        "properties": {
          "id": { "$ref": "#/$defs/id" },
          "digest": { "$ref": "#/$defs/sha256" },
          "adapters": {
            "type": "array",
            "minItems": 1,
            "maxItems": 8,
            "uniqueItems": true,
            "items": {
              "enum": [
                "GIT_IDENTITY",
                "NODE_TEST",
                "DOCS_VALIDATION",
                "DOCS_IMPACT",
                "INDEPENDENT_REVIEW",
                "MANUAL_INSPECTION"
              ]
            }
          },
          "executionKinds": {
            "type": "array",
            "minItems": 1,
            "maxItems": 2,
            "uniqueItems": true,
            "items": { "enum": ["AUTOMATED_CHECK", "INDEPENDENT_REVIEW"] }
          },
          "evidenceKinds": {
            "type": "array",
            "minItems": 1,
            "maxItems": 2,
            "uniqueItems": true,
            "items": { "enum": ["MEASURED", "REVIEWER_JUDGMENT"] }
          },
          "gateChecks": {
            "type": "array",
            "minItems": 1,
            "maxItems": 64,
            "uniqueItems": true,
            "items": {
              "type": "object",
              "additionalProperties": false,
              "required": ["gateId", "checkId", "checkContractDigest", "configurationDigest"],
              "properties": {
                "gateId": {
                  "enum": [
                    "candidate-identity",
                    "baseline-identity",
                    "required-score-evidence",
                    "documentation-validation",
                    "docs-impact-disposition",
                    "search-ai-discovery",
                    "independent-review",
                    "focused-tests",
                    "schema-projection-tests"
                  ]
                },
                "checkId": { "$ref": "#/$defs/id" },
                "checkContractDigest": { "$ref": "#/$defs/sha256" },
                "configurationDigest": { "$ref": "#/$defs/sha256" }
              }
            }
          },
          "reviewerIds": {
            "type": "array",
            "maxItems": 64,
            "uniqueItems": true,
            "items": { "$ref": "#/$defs/id" }
          }
        }
      }
    },
    "receiptAuthorizations": {
      "type": "array",
      "maxItems": 256,
      "items": {
        "type": "object",
        "additionalProperties": false,
        "required": ["evidenceId", "receiptId", "producerId"],
        "properties": {
          "evidenceId": { "$ref": "#/$defs/id" },
          "receiptId": { "$ref": "#/$defs/sha256" },
          "producerId": { "$ref": "#/$defs/id" }
        }
      }
    },
    "generatedAt": { "$ref": "#/$defs/timestamp" },
    "statement": { "type": "string", "minLength": 1, "maxLength": 8192 }
  },
  "$defs": {
    "id": {
      "type": "string",
      "minLength": 2,
      "maxLength": 96,
      "pattern": "^[a-z][a-z0-9-]*$"
    },
    "sha256": { "type": "string", "pattern": "^[a-f0-9]{64}$" },
    "timestamp": {
      "type": "string",
      "pattern": "^\\d{4}-\\d{2}-\\d{2}T\\d{2}:\\d{2}:\\d{2}(?:\\.\\d{3})?Z$"
    }
  }
}
